{
  "providers": [
    {
      "name": "Cerebras",
      "code_name": "cerebras",
      "tier": 1,
      "purpose": "Ultra-fast inference",
      "supports": ["sdk", "http"],
      "latency_s": [1, 3],
      "api_key_env": "CEREBRAS_API_KEY",
      "model": "llama3.1-70b",
      "status": "active"
    },
    {
      "name": "NVIDIA",
      "code_name": "nvidia",
      "tier": 1,
      "purpose": "GPU-accelerated processing",
      "supports": ["openai_compatible"],
      "latency_s": [2, 4],
      "api_key_env": "NVIDIA_API_KEY",
      "model": "deepseek-ai/deepseek-r1",
      "status": "active"
    },
    {
      "name": "Google Gemini 2.0",
      "code_name": "gemini2",
      "tier": 2,
      "purpose": "Advanced reasoning",
      "supports": ["http"],
      "latency_s": [3, 8],
      "api_key_env": "GEMINI2_API_KEY",
      "model": "gemini-2.0-flash",
      "status": "active"
    },
    {
      "name": "Codestral",
      "code_name": "codestral",
      "tier": 2,
      "purpose": "Code-oriented analysis",
      "supports": ["openai_compatible"],
      "latency_s": [3, 7],
      "api_key_env": "CODESTRAL_API_KEY",
      "model": "codestral-latest",
      "status": "active"
    },
    {
      "name": "Cohere",
      "code_name": "cohere",
      "tier": 3,
      "purpose": "Enterprise features",
      "supports": ["http"],
      "latency_s": [4, 8],
      "api_key_env": "COHERE_API_KEY",
      "model": "command-r-plus-08-2024",
      "status": "active"
    },
    {
      "name": "Groq2",
      "code_name": "groq2",
      "tier": 3,
      "purpose": "Enhanced speed",
      "supports": [],
      "latency_s": null,
      "api_key_env": "GROQ2_API_KEY",
      "model": null,
      "status": "planned",
      "supported": false,
      "message": "Implementation pending. Refer to roadmap Phase 6."
    },
    {
      "name": "GroqAI",
      "code_name": "groqai",
      "tier": 3,
      "purpose": "Fast inference",
      "supports": [],
      "latency_s": null,
      "api_key_env": "GROQAI_API_KEY",
      "model": null,
      "status": "planned",
      "supported": false,
      "message": "Implementation pending. Refer to roadmap Phase 6."
    },
    {
      "name": "Chutes AI",
      "code_name": "chutes",
      "tier": 4,
      "purpose": "Specialized tasks",
      "supports": ["openai_compatible"],
      "latency_s": [10, 30],
      "api_key_env": "CHUTES_API_KEY",
      "model": "zai-org/GLM-4.5-Air",
      "status": "active"
    },
    {
      "name": "DeepSeek",
      "code_name": "deepseek",
      "tier": 5,
      "purpose": "Code understanding",
      "supports": ["openrouter"],
      "latency_s": [3, 6],
      "api_key_env": "DEEPSEEK_API_KEY",
      "model": "deepseek/deepseek-chat-v3.1:free",
      "status": "active",
      "router": "openrouter"
    },
    {
      "name": "GLM 4.5",
      "code_name": "glm",
      "tier": 5,
      "purpose": "Multilingual analysis",
      "supports": ["openrouter"],
      "latency_s": [8, 15],
      "api_key_env": "GLM_API_KEY",
      "model": "z-ai/glm-4.5-air:free",
      "status": "active",
      "router": "openrouter"
    },
    {
      "name": "xAI Grok",
      "code_name": "grok",
      "tier": 5,
      "purpose": "Creative tasks",
      "supports": ["openrouter"],
      "latency_s": [6, 14],
      "api_key_env": "GROK_API_KEY",
      "model": "x-ai/grok-4-fast:free",
      "status": "active",
      "router": "openrouter"
    },
    {
      "name": "Moonshot Kimi",
      "code_name": "kimi",
      "tier": 5,
      "purpose": "Long context processing",
      "supports": ["openrouter"],
      "latency_s": [10, 20],
      "api_key_env": "KIMI_API_KEY",
      "model": "moonshotai/kimi-k2:free",
      "status": "active",
      "router": "openrouter"
    },
    {
      "name": "Qwen",
      "code_name": "qwen",
      "tier": 5,
      "purpose": "Multilingual",
      "supports": ["openrouter"],
      "latency_s": [8, 16],
      "api_key_env": "QWEN_API_KEY",
      "model": "qwen/qwen3-coder:free",
      "status": "active",
      "router": "openrouter"
    },
    {
      "name": "GPT-OSS",
      "code_name": "gptoss",
      "tier": 5,
      "purpose": "General purpose",
      "supports": ["openrouter"],
      "latency_s": [5, 12],
      "api_key_env": "GPTOSS_API_KEY",
      "model": "openai/gpt-oss-120b:free",
      "status": "active",
      "router": "openrouter"
    }
  ],
  "tiers": {
    "1": {
      "name": "Premium Speed",
      "description": "Ultra-fast inference providers for time-critical operations"
    },
    "2": {
      "name": "High Quality",
      "description": "Advanced reasoning and code analysis capabilities"
    },
    "3": {
      "name": "Commercial",
      "description": "Enterprise-grade providers with business features"
    },
    "4": {
      "name": "Specialized",
      "description": "Specialized models for niche use cases"
    },
    "5": {
      "name": "Free Fallbacks",
      "description": "Free-tier providers accessed via OpenRouter with automatic routing"
    }
  },
  "routing": {
    "strategy": "tier_based_failover",
    "order": [1, 2, 3, 4, 5],
    "openrouter_management": "OpenRouter manages Tier 5 provider selection based on availability and cost",
    "failover_on": ["error", "timeout", "quota_exceeded", "auth_failed"]
  },
  "metadata": {
    "last_updated": "2025-10-13",
    "version": "3.0.0",
    "source_of_truth": "src/amas/ai/router.py"
  }
}
